<?xml version="1.0" encoding="iso-8859-1"?>
<docencia xmlns="https://w3schools.com"
      xmlns:xsi="http://www.w3.org/2001/XMLSchema-instance"
      xsi:noNamespaceSchemaLocation="docencia.xsd">
  <grupo>1ASIR</grupo>
  <asignatura>
    <nombre></nombre>
    <horas>
      <hora time="22:50:00" />
      <hora time="23:50:00" />
    </horas>
    <profesor></profesor>
  </asignatura>
</docencia>